quotes,authors
"Once you replace negative thoughts with positive ones, you'll start having positive results.",Willie Nelson
"Yesterday is not ours to recover, but tomorrow is ours to win or lose.",Lyndon B. Johnson
Few things in the world are more powerful than a positive push. A smile. A world of optimism and hope. A 'you can do it' when things are tough.,Richard M. DeVos
"Live life to the fullest, and focus on the positive.",Matt Cameron
I think anything is possible if you have the mindset and the will and desire to do it and put the time in.,Roger Clemens
The most important thing is to try and inspire people so that they can be great in whatever they want to do.,Kobe Bryant
"A strong, positive self-image is the best possible preparation for success.",Joyce Brothers
"No matter what you're going through, there's a light at the end of the tunnel and it may seem hard to get to it but you can do it and just keep working towards it and you'll find the positive side of things.",Demi Lovato
Every day brings new choices.,Martha Beck
It's a wonderful thing to be optimistic. It keeps you healthy and it keeps you resilient.,Daniel Kahneman
"Work hard for what you want because it won't come to you without a fight. You have to be strong and courageous and know that you can do anything you put your mind to. If somebody puts you down or criticizes you, just keep on believing in yourself and turn it into something positive.",Leah LaBelle
"I truly believe that everything that we do and everyone that we meet is put in our path for a purpose. There are no accidents; we're all teachers - if we're willing to pay attention to the lessons we learn, trust our positive instincts and not be afraid to take risks or wait for some miracle to come knocking at our door.",Marla Gibbs
"Always Do Your Best. Your best is going to change from moment to moment; it will be different when you are healthy as opposed to sick. Under any circumstance, simply do your best, and you will avoid self-judgment, self-abuse and regret.",Don Miguel Ruiz
"Did I offer peace today? Did I bring a smile to someone's face? Did I say words of healing? Did I let go of my anger and resentment? Did I forgive? Did I love? These are the real questions. I must trust that the little bit of love that I sow now will bear many fruits, here in this world and the life to come.",Henri Nouwen
"To succeed, you need to find something to hold on to, something to motivate you, something to inspire you.",Tony Dorsett
A good laugh is sunshine in the house.,William Makepeace Thackeray
Your smile will give you a positive countenance that will make people feel comfortable around you.,Les Brown
"Work hard, stay positive, and get up early. It's the best part of the day.","George Allen, Sr."
"If you have a positive attitude and constantly strive to give your best effort, eventually you will overcome your immediate problems and find you are ready for greater challenges.",Pat Riley
Delete the negative; accentuate the positive!,Donna Karan
"The joy of life comes from our encounters with new experiences, and hence there is no greater joy than to have an endlessly changing horizon, for each day to have a new and different sun.",Christopher McCandless
"When you wake up every day, you have two choices. You can either be positive or negative; an optimist or a pessimist. I choose to be an optimist. It's all a matter of perspective.",Harvey Mackay
The person who can bring the spirit of laughter into a room is indeed blessed.,Bennett Cerf
"Your attitude is like a box of crayons that color your world. Constantly color your picture gray, and your picture will always be bleak. Try adding some bright colors to the picture by including humor, and your picture begins to lighten up.",Allen Klein
"Positive feelings come from being honest about yourself and accepting your personality, and physical characteristics, warts and all; and, from belonging to a family that accepts you without question.",Willard Scott
Always turn a negative situation into a positive situation.,Michael Jordan
"If you're not making mistakes, then you're not doing anything. I'm positive that a doer makes mistakes.",John Wooden
You cannot have a positive life and a negative mind.,Joyce Meyer
"I believe if you keep your faith, you keep your trust, you keep the right attitude, if you're grateful, you'll see God open up new doors.",Joel Osteen
Positive thinking will let you do everything better than negative thinking will.,Zig Ziglar
"I believe in karma, and I believe if you put out positive vibes to everybody, that's all you're going to get back.",Kesha
Today or any day that phone may ring and bring good news.,Ethel Waters
Don't let people disrespect you. My mom says don't open the door to the devil. Surround yourself with positive people.,"Cuba Gooding, Jr."
Positive anything is better than negative nothing.,Elbert Hubbard
"Correction does much, but encouragement does more.",Johann Wolfgang von Goethe
My optimism wears heavy boots and is loud.,Henry Rollins
I do believe we're all connected. I do believe in positive energy. I do believe in the power of prayer. I do believe in putting good out into the world. And I believe in taking care of each other.,Harvey Fierstein
My purpose: to lift your spirit and to motivate you.,Mavis Staples
"I surround myself with positive, productive people of good will and decency.",Ted Nugent
"The best thing to do when you find yourself in a hurting or vulnerable place is to surround yourself with the strongest, finest, most positive people you know.",Kristin Armstrong
Say and do something positive that will help the situation; it doesn't take any brains to complain.,Robert A. Cook
"You are the sum total of everything you've ever seen, heard, eaten, smelled, been told, forgot - it's all there. Everything influences each of us, and because of that I try to make sure that my experiences are positive.",Maya Angelou
"When you are enthusiastic about what you do, you feel this positive energy. It's very simple.",Paulo Coelho
"You're going to go through tough times - that's life. But I say, 'Nothing happens to you, it happens for you.' See the positive in negative events.",Joel Osteen
"Find a place inside where there's joy, and the joy will burn out the pain.",Joseph Campbell
"My dear friend, clear your mind of cant.",Samuel Johnson
Keep your face to the sunshine and you cannot see a shadow.,Helen Keller
I think a lot of times we don't pay enough attention to people with a positive attitude because we assume they are naive or stupid or unschooled.,Amy Adams
I often think that the night is more alive and more richly colored than the day.,Vincent Van Gogh
"A positive attitude is something everyone can work on, and everyone can learn how to employ it.",Joan Lunden
"Trust in dreams, for in them is hidden the gate to eternity.",Khalil Gibran
Believe that life is worth living and your belief will help create the fact.,William James
I like to encourage people to realize that any action is a good action if it's proactive and there is positive intent behind it.,Michael J. Fox
In order to carry a positive action we must develop here a positive vision.,Dalai Lama
I'm looking forward to influencing others in a positive way. My message is you can do anything if you just put your mind to it.,Justin Bieber
"That's my gift. I let that negativity roll off me like water off a duck's back. If it's not positive, I didn't hear it. If you can overcome that, fights are easy.",George Foreman
"People deal too much with the negative, with what is wrong. Why not try and see positive things, to just touch those things and make them bloom?",Thich Nhat Hanh
It takes but one positive thought when given a chance to survive and thrive to overpower an entire army of negative thoughts.,Robert H. Schuller
Perpetual optimism is a force multiplier.,Colin Powell
There is no advertisement as powerful as a positive reputation traveling fast.,Brian Koslow
"You've done it before and you can do it now. See the positive possibilities. Redirect the substantial energy of your frustration and turn it into positive, effective, unstoppable determination.",Ralph Marston
"You learn far more from negative leadership than from positive leadership. Because you learn how not to do it. And, therefore, you learn how to do it.",Norman Schwarzkopf
"The learner always begins by finding fault, but the scholar sees the positive merit in everything.",Georg Wilhelm Friedrich Hegel
"If you are given a chance to be a role model, I think you should always take it because you can influence a person's life in a positive light, and that's what I want to do. That's what it's all about.",Tiger Woods
Every positive value has its price in negative terms... the genius of Einstein leads to Hiroshima.,Pablo Picasso
"When someone does something good, applaud! You will make two people happy.",Samuel Goldwyn
"Dream small dreams. If you make them too big, you get overwhelmed and you don't do anything. If you make small goals and accomplish them, it gives you the confidence to go on to higher goals.",John H. Johnson
"But I have found that in the simple act of living with hope, and in the daily effort to have a positive impact in the world, the days I do have are made all the more meaningful and precious. And for that I am grateful.",Elizabeth Edwards
"I'm taking all the negatives in my life, and turning them into a positive.",Pitbull
"So long as you've got your friends about you, and a good positive attitude, you don't really have to care what everyone else thinks.",Gail Porter
"I always like to look on the optimistic side of life, but I am realistic enough to know that life is a complex matter.",Walt Disney
"Look up, laugh loud, talk big, keep the color in your cheek and the fire in your eye, adorn your person, maintain your health, your beauty and your animal spirits.",William Hazlitt
"It's your outlook on life that counts. If you take yourself lightly and don't take yourself too seriously, pretty soon you can find the humor in our everyday lives. And sometimes it can be a lifesaver.",Betty White
"You must not under any pretense allow your mind to dwell on any thought that is not positive, constructive, optimistic, kind.",Emmet Fox
"Positive thinking is more than just a tagline. It changes the way we behave. And I firmly believe that when I am positive, it not only makes me better, but it also makes those around me better.",Harvey Mackay
A lot of times people look at the negative side of what they feel they can't do. I always look on the positive side of what I can do.,Chuck Norris
"Instead of hating, I have chosen to forgive and spend all of my positive energy on changing the world.",Camryn Manheim
"There are powers inside of you which, if you could discover and use, would make of you everything you ever dreamed or imagined you could become.",Orison Swett Marden
"Pessimism leads to weakness, optimism to power.",William James
I was determined to share my positive approach and not let diabetes stand in the way of enjoying my life.,Paula Deen
"Look at people for an example, but then make sure to do things your way. Surround yourself with positive people.",Queen Latifah
Miracles occur naturally as expressions of love. The real miracle is the love that inspires them. In this sense everything that comes from love is a miracle.,Marianne Williamson
Talking is always positive. That's why I talk too much.,Louis C. K.
"I believe in Karma. If the good is sown, the good is collected. When positive things are made, that returns well.",Yannick Noah
I was blessed with certain gifts and talents and God gave them to me to be the best person I can be and to have a positive impact on other people.,Bryan Clay
The way positive reinforcement is carried out is more important than the amount.,B. F. Skinner
"I hope to make a positive, productive contribution, as cheesy as that may sound.",Chelsea Clinton
"Fortune cookies are a good idea. If the message is positive, it can make your day a little better.",Yao Ming
"When push comes to shove, it ain't the science that's going to lift you up - it's the belief, the spiritual side of life, that's going to lift you up, no matter what religion you are.",Kirstie Alley
"You can't make positive choices for the rest of your life without an environment that makes those choices easy, natural, and enjoyable.",Deepak Chopra
I am not embarrassed to tell you that I believe in miracles.,Corazon Aquino
Even when bad things happen you have to try to use those bad things in a positive manner and really just take the positive out of it.,Natalie du Toit
I believe that you should gravitate to people who are doing productive and positive things with their lives.,Nadia Comaneci
Winners make a habit of manufacturing their own positive expectations in advance of the event.,Brian Tracy
Sometimes the most positive thing you can be in a boring society is absolutely negative.,John Lydon
"Chaotic people often have chaotic lives, and I think they create that. But if you try and have an inner peace and a positive attitude, I think you attract that.",Imelda Staunton
"When I learn something new - and it happens every day - I feel a little more at home in this universe, a little more comfortable in the nest.",Bill Moyers
"As long as you as an individual... can convince yourself that in order to move forward as best you can you have to be optimistic, you can be described as 'one of the faithful,' one of those people who can say, 'Well, look, something's going to happen! Let's just keep trying. Let's not give up.",Tom Hanks
Our chief want is someone who will inspire us to be what we know we could be.,Ralph Waldo Emerson
The gift of fantasy has meant more to me than my talent for absorbing positive knowledge.,Albert Einstein
"I feel that sin and evil are the negative part of you, and I think it's like a battery: you've got to have the negative and the positive in order to be a complete person.",Dolly Parton
I've always believed that you can think positive just as well as you can think negative.,James Baldwin
"So there was a fire inside me. And that fire inside you, it can be turned into a negative form or a positive form. And I gradually realised that I had this fire and that it had to be used in a positive way.",John Newcombe
"Your destiny is to fulfill those things upon which you focus most intently. So choose to keep your focus on that which is truly magnificent, beautiful, uplifting and joyful. Your life is always moving toward something.",Ralph Marston
"First of all, I try to be a positive role model.",Caitlyn Jenner
I don't want to waste anyone's time or money. I want to give people some truth and positive heart lift.,Mos Def
The most positive men are the most credulous.,Alexander Pope
"There is a sense that things, if you keep positive and optimistic about what can be done, do work out.",Hillary Clinton
"Satisfaction consists in freedom from pain, which is the positive element of life.",Arthur Schopenhauer
"There is only one thing for us to do, and that is to do our level best right where we are every day of our lives; To use our best judgment, and then to trust the rest to that Power which holds the forces of the universe in his hands.",Orison Swett Marden
"You shall always find what you created in your mind, for instance, a benevolent God or an evil Devil. Between them are countless facets. Therefore, concentrate on the depth of your consciousness and on what you consider to be positive and good.",Hans Bender
"Having achieved my own dreams, I want to give to kids who are less fortunate, who struggle with everyday obstacles. I want to give them something positive in their lives: support.",Kristi Yamaguchi
You have to listen to the people who have a negative opinion as well as those who have positive opinion. Just to make sure that you are blending all these opinions in your mind before a decision is made.,Carlos Ghosn
"If it's great stuff, the people who consume it are nourished. It's a positive force.",Manuel Puig
"Some people never contribute anything positive to society, they may even drain our resources, but most of us try to do something better, to give back.",Martin Yan
"I'm totally into new age and self-help books. I used to work in a bookstore and that's the section they gave me, and I got way into it. I just loved the power of positive thinking, letting yourself go.",Jason Mraz
"Wondrous is the strength of cheerfulness, and its power of endurance - the cheerful man will do more in the same time, will do it; better, will preserve it longer, than the sad or sullen.",Thomas Carlyle
"A year or so ago I went through all the people in my life and asked myself: does this person inspire me, genuinely love me and support me unconditionally? I wanted nothing but positive influences in my life.",Mena Suvari
"Like success, failure is many things to many people. With Positive Mental Attitude, failure is a learning experience, a rung on the ladder, a plateau at which to get your thoughts in order and prepare to try again.",W. Clement Stone
"And I have to work so hard at talking positively to myself. If I don't, it's just real hard to get through the day, and I'll get really down, and just want to cry. My whole body language changes. I get more slumped over.",Delta Burke
A mediocre idea that generates enthusiasm will go further than a great idea that inspires no one.,Mary Kay Ash
Excellence encourages one about life generally; it shows the spiritual wealth of the world.,George Eliot
Perhaps one of the only positive pieces of advice that I was ever given was that supplied by an old courtier who observed: Only two rules really count. Never miss an opportunity to relieve yourself; never miss a chance to sit down and rest your feet.,Edward VIII
A President cannot always be popular.,Harry S Truman
"I really struggle with that feeling of helplessness. That's why I really try to get my blogs, and even myself, to point to the positive and look at all the inspiring things that are happening.",Daryl Hannah
"Where men of judgment creep and feel their way, The positive pronounce without dismay.",William Cowper
"I am fascinated by what is beautiful, strong, healthy, what is living. I seek harmony.",Leni Riefenstahl
A positive attitude can really make dreams come true - it did for me.,David Bailey
Don't forget to tell yourself positive things daily! You must love yourself internally to glow externally.,Hannah Bronfman
"In times of great stress or adversity, it's always best to keep busy, to plow your anger and your energy into something positive.",Lee Iacocca
"A positive attitude causes a chain reaction of positive thoughts, events and outcomes. It is a catalyst and it sparks extraordinary results.",Wade Boggs
Choosing to be positive and having a grateful attitude is going to determine how you're going to live your life.,Joel Osteen
"I think it's important to get your surroundings as well as yourself into a positive state - meaning surround yourself with positive people, not the kind who are negative and jealous of everything you do.",Heidi Klum
Positive energy and attitude is sexy to me.,Mya
"Successful people maintain a positive focus in life no matter what is going on around them. They stay focused on their past successes rather than their past failures, and on the next action steps they need to take to get them closer to the fulfillment of their goals rather than all the other distractions that life presents to them.",Jack Canfield
Your positive action combined with positive thinking results in success.,Shiv Khera
"Stay positive and happy. Work hard and don't give up hope. Be open to criticism and keep learning. Surround yourself with happy, warm and genuine people.",Tena Desae
"At the end of the day, the most overwhelming key to a child's success is the positive involvement of parents.",Jane D. Hull
I surround myself with good people who make me feel great and give me positive energy.,Ali Krieger
"A lot of things are going to happen that you can't necessarily control all the time, but you can control what you do after it happens. So that's what I try to do, keep my head up, keep moving forward, stay positive and just work hard.",Lonzo Ball
"Inspiration comes from within yourself. One has to be positive. When you're positive, good things happen.",Deep Roy
"When you think positive, good things happen.",Matt Kemp
Love yourself. It is important to stay positive because beauty comes from the inside out.,Jenn Proske
"Don't focus on negative things; focus on the positive, and you will flourish.",Alek Wek
"I am happy every day, because life is moving in a very positive way.",Lil Yachty
I always feel good after I change my hair. You get a haircut and feel positive and ready to take on the day.,Kirstin Maldonado
Adopting the right attitude can convert a negative stress into a positive one.,Hans Selye
"Exercise, prayer, and meditation are examples of calming rituals. They have been shown to induce a happier mood and provide a positive pathway through life's daily frustrations.",Chuck Norris
"While you're going through this process of trying to find the satisfaction in your work, pretend you feel satisfied. Tell yourself you had a good day. Walk through the corridors with a smile rather than a scowl. Your positive energy will radiate. If you act like you're having fun, you'll find you are having fun.",Jean Chatzky
What you feel inside reflects on your face. So be happy and positive all the time.,Sridevi
"Doing Good is a simple and universal vision. A vision to which each and every one of us can connect and contribute to its realisation. A vision based on the belief that by doing good deeds, positive thinking and affirmative choice of words, feelings and actions, we can enhance goodness in the world.",Shari Arison
"I'm not sure what the future holds but I do know that I'm going to be positive and not wake up feeling desperate. As my dad said 'Nic, it is what it is, it's not what it should have been, not what it could have been, it is what it is.'",Nicole Kidman
Stop saying these negative things about yourself. Look in the mirror and find something about yourself that's positive and celebrate that!,Tyra Banks
"Life is short, youth is finite, and opportunities endless. Have you found the intersection of your passion and the potential for world-shaping positive impact? If you don't have a great idea of your own, there are plenty of great teams that need you - unknown startups and established teams in giant companies alike.",Justin Rosenstein
Having a positive mental attitude is asking how something can be done rather than saying it can't be done.,Bo Bennett
"I'm self-motivated. I'm motivated for myself to be the best I can be - for me to do that, I have to have my own motivation, my own positive energy.",Deshaun Watson
A strong positive mental attitude will create more miracles than any wonder drug.,Patricia Neal
"I think that life is difficult. People have challenges. Family members get sick, people get older, you don't always get the job or the promotion that you want. You have conflicts in your life. And really, life is about your resilience and your ability to go through your life and all of the ups and downs with a positive attitude.",Jennifer Hyman
"Things don't always go your way in football: there are always good and bad times. At the end of the day, you have to have a positive attitude and a strong mentality and not let any setbacks get you down. And that's what I've done - I've tried to keep my composure, even when things aren't going the way I'd like.",Giovani Dos Santos
"Be true to yourself and surround yourself with positive, supportive people.",Payal Kadakia
"The internet could be a very positive step towards education, organisation and participation in a meaningful society.",Noam Chomsky
"One day, I will tell my story... where I came from and where I am now and how I remained positive.",Nargis Fakhri
"Being sexy, to me, is possessing the full package: the brains, the drive, inner confidence, spiritual foundation, a positive attitude, proceeding through obstacles, making a positive contribution to the world, and maintaining a healthy lifestyle.",Mya
God never ends anything on a negative; God always ends on a positive.,Edwin Louis Cole
All I can control is myself and just keep having a positive attitude.,Rose Namajunas
"We are constituted so that simple acts of kindness, such as giving to charity or expressing gratitude, have a positive effect on our long-term moods. The key to the happy life, it seems, is the good life: a life with sustained relationships, challenging work, and connections to community.",Paul Bloom
"The more you are positive and say, 'I want to have a good life,' the more you build that reality for yourself by creating the life that you want.",Chris Pine
"Each day, I come in with a positive attitude, trying to get better.",Stefon Diggs
"In every day, there are 1,440 minutes. That means we have 1,440 daily opportunities to make a positive impact.",Les Brown
"There must be a positive and negative in everything in the universe in order to complete a circuit or circle, without which there would be no activity, no motion.",John McDonald
"I'm a pretty positive person, so a bad mood is quite a big deal.",Karla Crome
"Being positive is like going up a mountain. Being negative is like sliding down a hill. A lot of times, people want to take the easy way out, because it's basically what they've understood throughout their lives.",Chuck D
It doesn't matter what cards you're dealt. It's what you do with those cards. Never complain. Just keep pushing forward. Find a positive in anything and just fight for it.,Baker Mayfield
"My wife Cecily Adams was dying of cancer, my daughter Madeline was struggling to overcome an autism diagnosis, and my father was dying, all at the same time. Writing the journal was a cathartic experience, and an extremely positive one.",Jim Beaver
