quotes,authors
"Donald's monstrosity is the manifestation of the very weakness within him that he's been running from his entire life. For him, there has never been any option but to be positive, to project strength, no matter how illusory, because doing anything else carries a death sentence; my father's short life is evidence of that.",Mary L. Trump
"My father said, '10 minus one is zero.' It means that even if you do good things 10 times, it is no use when you do some bad thing once. But it doesn't mean that I think I have positive image, so I always need to be careful about what I'm doing. I don't want to frame myself.",Park Bo-gum
It never gets old seeing somebody do something positive for somebody else.,Xzibit
"My husband believed 'the herb' was a natural and positive part of life, and he felt it was important to the world.",Rita Marley
"I would love to have a child. It would be great for me and such a positive message for all the girls out there who don't want to rush their life or their life has taken different a direction, like me who's put their career first.",Gemma Collins
"Too often, women are waiting for someone to recognise their great work and tap them on the shoulder and say, 'Here - this is the next thing we want you to do,' and that may happen. But I feel you need to take more ownership of telling your story, advocating for yourself. You can do it in a way that's positive and that your leaders will appreciate.",Lynne Doughtie
"I am pleased to say that I am not a tortured comedian - I laugh a lot. My twenties weren't particularly happy, but it's the same for a lot of people. In your thirties, you realise that your life and your worries are really insignificant, and you have to force yourself to be more positive and take each day as a gift.",Miranda Hart
"You want to try to play the game in a really good positive way, not just on the field but off the field as well in being a positive person and getting good vibes out to the community.",Israel Folau
The only reason to have a positive mental attitude is that it makes life better. It doesn't cure cancer.,Molly Ivins
I believe in human-centered AI to benefit people in positive and benevolent ways.,Fei-Fei Li
"Each season I find myself constantly inspired by 'The Biggest Loser' contestants. Their tenacity and willingness to learn new, healthy habits is tremendous and the results speak for themselves. I am honored to be part of such an inspiring program that helps inspire positive change in so many lives.",Curtis Stone
Something I've noticed as I get older is that I do think about the future more. It's all positive thinking.,Abbie Cornish
"Propaganda has a negative connotation, which it partially deserves, but I think there is some propaganda that is very positive. I feel that if you can do something that gets people's attention, then maybe they'll go and find out more about the person.",Shepard Fairey
"In a spiritual sense, a positive attitude may help you get through chemotherapy and surgery and radiation and what have you. But a positive mental attitude does not cure cancer - any more than a negative mental attitude causes cancer.",Siddhartha Mukherjee
"Actually creating a positive school climate, particularly in schools that are in communities that are themselves not calm and orderly, is hard work.","James Forman, Jr."
"Many persons swear by positive thinking, and quite a few have been helped by it. Nevertheless, it is not a very effective tool and can be downright harmful in some cases.",Srikumar Rao
"Stage fright is not a thing about 'Am I any good?' It's about 'Am I gonna be good tonight?' It's a right-now thing. It helps me. If I went out there thinkin', 'Eh, we'll go slaughter 'em,' I'm positive something would go seriously wrong.",Gregg Allman
"It's an important thing to have a relationship with the director, and have it be a positive one.",Trevor Rabin
"The exchange rate of the Rand against the dollar, pound or euro makes South Africa an attractive location. The positive side of this is it gives our artists and technicians an opportunity to work.",John Kani
I have always said that I do not pay much attention to what is said. Not to the positive and not to the negative.,Thomas Muller
"Guilt is just as powerful, but its influence is positive, while shame's is destructive. Shame erodes our courage and fuels disengagement.",Brene Brown
"I always say just stay positive. If you ever get down on yourself, try to find something that takes away that negative. Always find that positive area.",Kane Brown
"If I knew I was positive, why would I have ever gone to PAW to take a test?",Marc Wallice
"I'm very conscious of my body, and how I take care of it. I like clean foods, drink a lot of water, and soak up much sunlight and positive energy as I can.",Princess Nokia
The deaf community is hungry to see itself in the most positive way.,Lupe Ontiveros
"Every company has messy data, and even the best of AI companies are not fully satisfied with their data. If you have data, it is probably a good idea to get an AI team to have a look at it and give feedback. This can develop into a positive feedback loop for both the IT and AI teams in any company.",Andrew Ng
"Any time you can have an impact on anybody's life in a positive direction, to bring happiness to the community or a certain group of people, you don't take that lightly as a team, as a player.",Christian Yelich
"It's really important to always have a positive mind-set, no matter what people have been through.",Oti Mabuse
People often confuse a growth mindset with being flexible or open-minded or with having a positive outlook - qualities they believe they've simply always had. My colleagues and I call this a false growth mindset.,Carol S. Dweck
"I look at the NFL and see how the transition has gone at quarterback. I might be coming along at a good time. For me personally, this is about doing the same thing I've been doing at USF - just smile, have fun, enjoy the experience, keep a positive attitude and encourage my teammates. I like to feed off the people around me.",B. J. Daniels
"When families are strong and stable, so are children - showing higher levels of wellbeing and more positive outcomes. But when things go wrong - either through family breakdown or a damaged parental relationship - the impact on a child's later life can be devastating.",Iain Duncan Smith
"If I can inspire someone to go in a positive way and pursue a dream, it can only be good.",Parminder Nagra
"Positive energy is meant to give people confidence and hope, encourage people to love their country, society and life, as well as to pursue nice things. Everything we do is ultimately for the sake of spreading positive energy.",Lu Wei
The Labour party is not perfect but I have seen in my own life how it is the greatest vehicle for positive hopeful social change.,Jess Phillips
Failure is enriching. It's also important to accept that you'll make mistakes - it's how you build your expertise. The trick is to learn a positive lesson from all of life's negative moments.,Alain Ducasse
"My first instinct when I write songs is not a negative one. It's something positive... Everything I've ever done has some form of hope in it, I think.",Noel Gallagher
"The content I create reflects my personality: goofy, fun, positive, a bit clumsy, family-friendly, educational and helpful.",Rosanna Pansino
"Negative comments in terms of body image are the hardest thing the women probably struggle with. But I think the best thing that we can do as WWE superstars is taking that negativity and using it in a positive way, because there are so many young kids on Instagram, Facebook, and Twitter to not send the message of hate on to.",Charlotte Flair
"Perseverance is a positive, active characteristic.",Joseph B. Wirthlin
"You have to be positive, and I'm not just talking about athletics, this also applies to life.",Sheryl Swoopes
I'm an activist. I'm a proud activist. So I want to be someone who is pro-black and pro-Africa and still be somebody that has positive influence.,Kat Graham
Even if things are not going well for you... just stay in the positive way of thinking.,Anitta
Being surrounded with such positive people always helps.,Donovan Bailey
As a person who is not confrontational by disposition I tend to see that the quality of being confrontational is a positive attribute.,John Hall
"If you want positive search results, do positive things. If you don't want negative search results, don't do negative things. To some of my colleagues across the aisle, if you're getting bad press articles and bad search results, don't blame Google or Facebook or Twitter. Consider blaming yourself.",Ted Lieu
Winning is good but is better when it becomes a means of hope and positive change in the lives of those who are deprived.,Emmanuel Adebayor
"It's our responsibility for the village to say, 'Hey we're going to create these programs,' whether it's sports, creative arts, music, we need some things to give young people positive things to do, and that's including jobs.",Common
"I had confidence in my quality, so I was always positive and had good objectivity.",Riyad Mahrez
"A lasting solution to this problem will have an exceptionally positive influence foremost on the peoples of Palestine and Israel, as well as on the region and the international community.",Recep Tayyip Erdogan
Good debt accrues assets that generate positive returns and externalities.,Anthony Scaramucci
"Very gifted people, they win and they win, and they are told that they win because they are a winner. That seems like a positive thing to tell children, but ultimately, what that means is when they lose, it must make them a loser.",Joshua Waitzkin
"Just like it's not healthy to think overly negative thoughts, exaggeratedly positive thoughts can be equally detrimental. If you overestimate how much of a positive impact a particular change will have on your life, you may end up feeling disappointed when reality doesn't live up to your fantasy.",Amy Morin
"I get nostalgic for British negativity. There is an inherent hope and positive drive to New Yorkers. When you go back to Britain, everybody is just running everything down. It's like whatever the opposite of a hug is.",John Oliver
"I'm very naturally happy, quirky and positive.",Kiesza
"People always accuse me of being motivational in a way, like it was a bad thing, but that's just how I was raised. My mom raised me in a positive environment, with lots of love in my heart, and that reflects in my music.",Lenny Kravitz
The X Factor' was amazing because I like being a positive role model to young artists; that's what I believe in. If I can shed some light and give them some tips on how to believe in themselves and be more confident with their craft.,Redfoo
You don't have to be positive all the time.,Amy Purdy
"Since taking office, President Obama has worked to restore a positive vision of American leadership in the world - leadership defined, not by the threats and dangers that we will oppose, but by the security, opportunity and dignity that America advances in partnership with people around the world.",John O. Brennan
"I would absolutely recommend against excessive positivity and optimism. Any positive emotion that you're infusing into a workplace needs to be grounded in reality. If it's not realistic, sincere, meaningful, and individualized, it won't do much good.",Tom Rath
"Bad influences and distractions were around every corner. But I also learned that my neighborhood could be a nurturing, positive place to grow up.",Ayanna Pressley
"I realize I will always be the poster child for police brutality, but I can try to use that as a positive force for healing and restraint.",Rodney King
"I faced quite a few challenging times, and in front of those, I was more positive than some people not facing those conditions. I'm actually of the belief now that it is that struggle that offers you that open-hearted hope.",K'naan
"No one has a life where everything that happened was good. I think the thing that made life good for me is that I never looked back. I've always been positive, no matter what happened.",Wilma Rudolph
I want to be remembered for doing something bigger than myself and making a positive impact on the world. I want to make my life worth something and to die a legend and to make my family proud.,Jessie Reyez
"I don't think I could, with a straight face, describe myself as a completely positive person, but I'm not overly negative, either. On the whole, most writers think plots through to their consequences, and it's not always a sunny place. I have an occupational temperament for anxiety.",James Lasdun
I don't really understand this negative or positive role thing. A role is a role.,Jim Sarbh
"Sometimes negative news does come out, but it is often exaggerated and manipulated to spread scandal. Journalists sometimes risk becoming ill from coprophilia and thus fomenting coprophagia: which is a sin that taints all men and women, that is, the tendency to focus on the negative rather than the positive aspects.",Pope Francis
"In the end, the whole Internet thing kills me, because you can use it as a positive thing or you can read into all the negativity. And I think you've gotta put out positive energy, put out cool viral stuff, and then just stay out of people's opinions.",Nikki Sixx
"I have never won a race, and that is my main disappointment - but you have to be positive.",Jean Alesi
"Although I take the medication, which has made a huge impact on my life in a positive way, still, honestly, when I'm a bit sick is when I'm at my most creative.",Beth Hart
"Most of the people I know who work out seriously do so because they have such an amazing outlook on life. To be who I want to be, I'm going to work out to be more positive, more active. It's proactive.",John Krasinski
"The stereoscopic panoramic videos that we're showing on Samsung VR are getting a lot of positive traction. It's exciting when you see creative types - whether from the music, film, or video industries - look at this stuff. The gears are turning in their head almost immediately about how they can use it as a new medium.",John Carmack
"Internally, we have so many different parts, both positive and negative. And if you force them together, a spark comes out.",Arca
I am not trendy. I am not 'in fashion.' I am simply a positive human being who has a positive outlook on life.,Thierry Mugler
"Over the last three years, UCLA has helped me grow as an athlete, a scholar, and a member of the community. I have made some mistakes along the way; however, I am grateful that I made those mistakes backed by such a supportive and positive university so that I could learn from them and better myself.",Josh Rosen
"In the case of Iraq, notwithstanding the violence there at the moment, the very fact that a hideous regime - responsible for genocide, for the use of chemical and biological weapons, aggression against two neighbors - has been removed in itself is a positive development.",Jose Ramos-Horta
The positive and negative poles of a battery create an electrical flow. The masculine and feminine poles between people create a flow of sexual energy in motion.,David Deida
"Since I've been in Playboy myself in Australia, I love it, and I think it's really empowering and positive towards women, which is not a view that many women hold.",Dannii Minogue
You want to focus on the fans and on the positive energy that you receive from them.,Lance Stroll
"As soon as I starting making YouTube videos, I received so much positive feedback from the online community and a demand for more content. As time went on, my filming schedule became more consistent, and it made sense to hire some help and upgrade my equipment.",Rosanna Pansino
I presume that nobody will deny the positive aspects of the North American cultural world. These are well known to all. But these aspects do not make one forget the disastrous effects of the industrial and commercial process of 'cultural lamination' that the USA is perpetrating on the planet.,Jose Saramago
"The overall vision for 'Utopia' was somewhat of a mix between fantasy, future, and ancient China. All of it soaked in a pastel space sauce to capture the uber positive energy of the music.",Kerli
People look up to me as somebody who is able to switch the image of our country from negative to positive.,Novak Djokovic
"Being a person is really hard, obviously depending on your background for some people it can be much harder, but mental health and how we feel about ourselves is so key to changing the world in a positive way.",Kate Nash
I'm a positive dude.,Madlib
"I've felt that if you dwell too much on your errors, you're dealing in the negativity of things. I don't like that. I'd rather work on the positive reinforcement, the things I did well.",Hale Irwin
"I'm one of five sisters. I'm the younger of twins, and we're the youngest of five girls, and we've always been very close. We were pretty much a gang. I take after my mother a lot in terms of personality and character. She was very positive; always looked on the bright side of things. She had a tough time of it with my dad but did her best.",Jerry Hall
I can take all the negative energy and turn it into a positive simply by purging my soul through music. That's how powerful music can be.,Bow Wow
"It's going to take baby steps to see a complete turnaround. But there's been such a positive outcome from seeing it at Fashion Week. Plus-size fashion shows are being more welcomed into Fashion Week, and having more plus-size women in major magazines.",Ashley Nell Tipton
"To sustain the Trump Revolution, we must empower Trump's champions to drive positive change across America. And we must defeat 'Never Trump' elements wherever we find them.",Matt Gaetz
I have to stay positive and try to find time to do what I want to do while working at the same time.,Lee Min-ho
"What is social proof? Put simply, it's the positive influence created when someone finds out that others are doing something. It's also known as informational social influence.",Aileen Lee
I bought myself a DVD set of 'Lost' and only allowed myself to watch it while I was strength training. Sometimes I'd exercise longer than I intended to because I didn't want to turn it off. Talk about positive reinforcement!,Heidi Roizen
"Having those positive friends around can really make a difference in how you view yourself. It's helped me realize that there's no such thing as having a perfect body, and just because I'm not shaped the same way as another girl is, it doesn't mean I'm not pretty. It just means that no two girls are alike.",Lauren Jauregui
"That's what makes Linux so good: you put in something, and that effort multiplies. It's a positive feedback cycle.",Linus Torvalds
"President Trump has a magnetic personality and exudes positive energy, which is infectious to those around him.",Hope Hicks
"And of course, pop music is all about memorability and simplicity and positive messages and a little dash of joy.",Feist
"I'm pretty positive, optimistic, so I always expect the best.",Jurgen Klopp
You have to think for your team-mates and give them positive response. Whatever happens as a captain you have to take the responsibility. Backing my team-mates and supporting them was the biggest learning.,Ajinkya Rahane
"When I was eight, my piano teacher played seven or eight notes, and I sang them. She stopped and looked at me in shock! That was the first time I'd gotten that reaction. I'd had looks of horror, but never shock in a positive way.",Chris Cornell
Yoga disciplines both the mind and the souls and not just your body. It helps me in having a constant positive outlook in life. I would love my family to adopt this form of fitness as well.,Jacqueline Fernandez
"I've got rid of a lot of cynicism and anger. I feel positive about my development, and I just want to carry on making music and building myself as a person.",King Krule
The influence of blogging is overall a very positive force in the media.,Garrett Graff
"Lower taxes, less regulations, less lawsuits, deals that support U.S. manufacturers is all very positive.",John Paulson
"There is no racial or ethnic involvement in Thanksgiving, and people who may be very distant from the Christian system can see the beauty and the positive spirit that comes from the holiday.",John Clayton
I'm always going to try to win with a positive mindset.,Brock Osweiler
I surrounded myself with very positive people who only wanted the best for me. I loved high school as a whole. I consider myself really lucky.,Gigi Gorgeous
WWE is home; it's a family. I'll always be a part of this as long as I can contribute in some positive way. But I know there's a time when the sun sets on everything.,Big Show
"'Utopia' is a positive and constructive program that gives people the opportunity, if you can start all over again, start from scratch and create laws and make decisions, will you be able to build a society that is better than the one we have; will it be chaos or happiness.","John de Mol, Jr."
"Of the thousands of ways that humans differ from one another, turns out there's this one cluster of traits called conscientiousness that predict a whole host of positive life outcomes, such as longevity over our health, life satisfaction.",Daniel Levitin
"Honestly, I've always been a very positive person and I maintained that even when my family tested COVID positive or when I gave birth in the middle of a pandemic.",Koel Mallick
"Stop being a critic and be a light; don't be a judge, be a model. I think we are far too critical. I think the best way to correct behavior is to accentuate and affirm positive behavior and to ignore negative behavior. Generally speaking, there is a time to correct, of course; but my biggest advice would be, 'Affirm your child.'",Sean Covey
"Kids tend to look up to sports figures and entertainers, probably more than they should, but I've tried to use that in a positive way.",Warren Moon
"I loved all the princess films, and I grew up with them, and I think it's really cool how they've changed over the years - how the princesses have become more positive role models right up until 'Frozen.'",Lily James
"As writers and readers, as sinners and citizens, our realism and our aesthetic sense make us wary of crediting the positive note.",Seamus Heaney
"I lived in the projects and the ghetto, and turned the negative into a positive.",Wyclef Jean
"Prior to getting into music, I interacted with, on a daily basis, about 5-10 percent of the people that I've interacted with since then. I've been meeting people from different backgrounds and different cultures. That did allow for a lot of change. I've changed as a product of that, but it's been positive.",Sam Hunt
A core part of Teach For America's mission has always been affecting positive change in the traditional public school system.,Wendy Kopp
The similarity between my music and The Beatles' music is it has within it a very positive quality. It's woven with humor.,Donovan
There are plenty of studies that have shown that depression is associated with decreased immunity. So I want to harness all of the positive emotional energy I can in a patient to get better.,Allan Hamilton
I've been completely surprised at the outpouring of just incredible amounts of positive feedback and love from people all day long.,Chris March
"I want to be remembered for the good work that I've done, for the positive work, and as somebody who was innovative and who people enjoyed.",Evan Ross
The key thing about wealth in a capitalist economy is that it reproduces itself and usually earns a positive net return.,Robert Solow
"Pride is tough. You go to high school, and its 'pride,' 'courage;' it's all these types of words that we use to motivate us. I don't think there's anywhere in the Scriptures through the saints' lives where pride was ever a positive characteristic of anybody.",Troy Polamalu
"'Grease' changed my life in the most amazing way, and I've had such an amazing life. When things go wrong, you've got to believe you will get through them and focus on the positive things in your life.",Olivia Newton-John
"To protect people's lives and keep our children safe, we must implement public-works spending and do so proudly. If possible, I'd like to see the Bank of Japan purchase all of the construction bonds that we need to issue to cover the cost. That would also forcefully circulate money in the market. That would be positive for the economy, too.",Shinzo Abe
I'm motivated by the positive ways in which Bitcoin use being widespread will make the world a better place.,Roger Ver
So much money and energy is expended making a film that I think it should be used for positive ends.,David Strathairn
We can in fact first place the beam of rays of moving positive atomic ions in a plane perpendicular to the axis in which we see the spectral lines emitted by them.,Johannes Stark
"I'm part of the mushball middle. I consider 'confused' the majority position because, thankfully, most people would rather be uncertain some of the time than 100% positive all the time - even when they're wrong.",Al Franken
I have always felt like I am a positive player.,K. L. Rahul
"Climate change is not an excuse for the EPA to ignore the bounds of law and issue illegal regulations that will cost jobs, shutter industries, and have little to no positive impact on the environment.",Luther Strange
"I always felt that, through it all, there was a really strong, forward, positive, constructive accomplishment by the American people during that period, if you consider that during the period from 1954 to 1965, this country broke through the caste system.",John Doar
"I'm concentrating on the positive, on all the wonderful things I'm doing now.",Tia Carrere
